Name of the Journal,Website URL
Advances in Crop Science and Technology Open Access Journal,https://www.omicsonline.org/advances-crop-science-and-technology.php
Agrotechnology Open Access Journal,https://www.omicsonline.org/agrotechnology.php
Asian Journal of Plant Science & Research Open Access,http://www.imedpub.com/asian-journal-of-plant-science-research/
Fisheries and Aquaculture Journal Open Access Journal,https://www.omicsonline.org/fisheries-and-aquaculture-journal.php
Journal of Agricultural Science and Food Research Open Access Journal,https://www.omicsonline.org/biofertilizers-biopesticides.php
"Journal of Aquaculture Research & Development Open Access Journal, Official Journal of Reef Ball Foundation",https://www.omicsonline.org/aquaculture-research-development.php
Journal of Fisheries & Livestock Production Open Access Journal,https://www.omicsonline.org/fisheries-livestock-production.php
Journal of FisheriesSciences.com Open Access Journal,http://www.fisheriessciences.com/
Journal of Horticulture Open Access Journal,https://www.omicsonline.org/horticulture.php
"Journal of Marine Science: Research & Development Open Access Journal, Official Journal of Reef Ball Foundation",https://www.omicsonline.org/marine-science-research-development.php
Journal of Plant Pathology & Microbiology Open Access Journal,https://www.omicsonline.org/plant-pathology-microbiology.php
"Poultry, Fisheries & Wildlife Sciences Open Access Journal",https://www.omicsonline.org/poultry-fisheries-wildlife-sciences.php
Research & Reviews: Journal of Agriculture and Allied Sciences Open Access Journal,http://www.rroij.com/agriculture-and-allied-sciences.php
Rice Research: Open Access Open Access Journal,https://www.omicsonline.org/rice-research.php
VEGETOS: An International Journal of Plant Research Open Access Journal,https://www.scitechnol.com/vegetos.php
Biochemistry & Analytical Biochemistry Open Access Journal,https://www.omicsonline.org/biochemistry-and-analytical-biochemistry.php
Biochemistry & Molecular Biology Journal Open Access Journal,http://biochem-molbio.imedpub.com
Biochemistry & Physiology: Open Access Open Access Journal,https://www.omicsonline.org/biochemistry-physiology-open-access.php
BioChemistry: An Indian Journal ,http://www.tsijournals.com/journals/biochemistry-an-indian-journal.html
Bioenergetics: Open Access Open Access Journal,https://www.omicsonline.org/bioenergetics.php
Clinical & Medical Biochemistry Open Access Journal,https://www.omicsonline.org/clinical-medical-biochemistry.php
Enzyme Engineering Open Access Journal,https://www.omicsonline.org/enzyme-engineering.php
Journal of Biochemical and Microbial Toxicology ,https://www.omicsonline.org/journal-biochemical-microbial-toxicology.php
Journal of Biochemistry and Cell Biology ,https://www.omicsonline.org/journal-biochemistry-cell-biology.php
Journal of Chemical Biology & Therapeutics Open Access Journal,https://www.omicsonline.org/chemical-biology-therapeutics.php
journal of clinical chemistry and laboratory medicine ,https://www.omicsonline.org/journal-clinical-chemistry-laboratory-medicine.php
Journal of Glycobiology Open Access Journal,https://www.omicsonline.org/glycobiology.php
Journal of Membrane Science & Technology Open Access Journal,https://www.omicsonline.org/membrane-science-technology.php
Journal of Plant Biochemistry & Physiology Open Access Journal,https://www.omicsonline.org/plant-biochemistry-physiology.php
Macromolecules: An Indian Journal ,http://www.tsijournals.com/journals/macromolecules-an-indian-journal.html
American Journal of Computer Science and Information Technology Open Access Journal,http://www.imedpub.com/computer-science-and-information-technology/
Chemical Informatics Open Access Journal,http://cheminformatics.imedpub.com/
Current Synthetic and Systems Biology Open Access Journal,https://www.omicsonline.org/current-synthetic-and-systems-biology.php
Endocrinology and Metabolism: Open Access ,http://www.imedpub.com/endocrinology-metabolism-open-access/
Journal of Applied Bioinformatics & Computational Biology Hybrid Open Access Journal,https://www.scitechnol.com/applied-bioinformatics-computational-biology.php
Journal of Computer Science & Systems Biology Open Access Journal,https://www.omicsonline.org/computer-science-systems-biology.php
Journal of Data Mining in Genomics & Proteomics Open Access Journal,https://www.omicsonline.org/data-mining-in-genomics-proteomics.php
Journal of Glycomics & Lipidomics Open Access Journal,https://www.omicsonline.org/glycomics-lipidomics.php
Journal of Health & Medical Informatics Open Access Journal,https://www.omicsonline.org/health-medical-informatics.php
Journal of In Silico & In Vitro Pharmacology Open Access Journal,http://pharmacology.imedpub.com/
Journal of Informatics and Data Mining Open Access Journal,http://datamining.imedpub.com/
Journal of Next Generation Sequencing & Applications Open Access Journal,https://www.omicsonline.org/next-generation-sequencing-applications.php
Journal of Phylogenetics & Evolutionary Biology Open Access Journal,https://www.omicsonline.org/phylogenetics-evolutionary-biology.php
Journal of Proteomics & Bioinformatics Open Access Journal,https://www.omicsonline.org/proteomics-bioinformatics.php
Journal of Proteomics & Enzymology Hybrid Open Access Journal,http://scitechnol.com/proteomics-enzymology.php
Journal of Theoretical & Computational Science Open Access Journal,https://www.omicsonline.org/theoretical-and-computational-science.php
Metabolomics: Open Access Open Access Journal,https://www.omicsonline.org/metabolomics-open-access.php
Transcriptomics: Open Access Open Access Journal,https://www.omicsonline.org/transcriptomics.php
Advanced Techniques in Biology & Medicine Open Access Journal,https://www.omicsonline.org/advanced-techniqes-biology-medicine.php
Biology and Medicine Open Access Journal,https://www.omicsonline.org/biology-and-medicine.php
Central European Journal of Experimental Biology Open Access Journal,http://www.scholarsresearchlibrary.com/journals/central-european-journal-of-experimental-biology/
Insights in Biomedicine Open Access Journal,http://biomedicine.imedpub.com
International Journal of Biomedical Data Mining Open Access Journal,https://www.omicsonline.org/biomedical-data-mining.php
Journal of Bioengineering & Biomedical Science Open Access Journal,https://www.omicsonline.org/bioengineering-biomedical-science.php
Journal of Biomedical and Pharmaceutical Sciences ,https://www.omicsonline.org/journal-biomedical-pharmaceutical-sciences.php
Journal of Biomedical Engineering and Medical Devices Open Access Journal,https://www.omicsonline.org/biomedical-engineering-medical-devices.php
Journal of Biomedical Sciences Open Access Journal,http://www.jbiomeds.com/
Journal of Biomedical Systems & Emerging Technologies Open Access Journal,https://www.omicsonline.org/biomedical-systems-emerging-technologies.php
Journal of Biomolecular Research & Therapeutics Open Access Journal,https://www.omicsonline.org/biomolecular-research-therapeutics.php
Journal of Diagnostic Techniques and Biomedical Analysis Hybrid Open Access Journal,https://www.scitechnol.com/diagnostic-techniques-biomedical-analysis.php
Translational Biomedicine Open Access Journal,http://www.transbiomedicine.com/
Arabian Journal of Business and Management Review Open Access Journal,https://www.omicsonline.org/arabian-journal-business-management-review.php
Business and Economics Journal Open Access Journal,https://www.omicsonline.org/business-and-economics-journal.php
International Journal of Accounting Research Open Access Journal,https://www.omicsonline.org/international-journal-accounting-research.php
International Journal of Economics & Management Sciences Open Access Journal,https://www.omicsonline.org/economics-and-management-sciences.php
Journal of Accounting & Marketing Open Access Journal,https://www.omicsonline.org/accounting-marketing.php
Journal of Business & Financial Affairs Open Access Journal,https://www.omicsonline.org/business-and-financial-affairs.php
Journal of Defense Studies and Resource Management Hybrid Open Access Journal,https://www.scitechnol.com/defense-studies-resource-management.php
Journal of Entrepreneurship & Organization Management Open Access Journal,https://www.omicsonline.org/entrepreneurship-organization-management.php
Journal of Global Economics Open Access Journal,https://www.omicsonline.org/global-economics.php
Journal of Hotel & Business Management Open Access Journal,https://www.omicsonline.org/hotel-business-management.php
Journal of Stock & Forex Trading Open Access Journal,https://www.omicsonline.org/stock-forex-trading.php
Journal of Tourism & Hospitality Open Access Journal,https://www.omicsonline.org/tourism-hospitality.php
Journal of Tourism Research & Hospitality Hybrid Open Access Journal,https://www.scitechnol.com/tourism-research-hospitality.php
Review of Public Administration and Management Open Access Journal,https://www.omicsonline.org/review-public-adminstration-management.php
Journal of Advanced Chemical Engineering Open Access Journal,https://www.omicsonline.org/advanced-chemical-engineering.php
Journal of Bioprocessing & Biotechniques Open Access Journal,https://www.omicsonline.org/bioprocessing-biotechniques.php
Journal of Chemical Engineering & Process Technology Open Access Journal,https://www.omicsonline.org/chemical-engineering-process-technology.php
Journal of Thermodynamics & Catalysis Open Access Journal,https://www.omicsonline.org/thermodynamics-catalysis.php
Acta Chimica and Pharmaceutica Indica  Open Access Journal,http://www.tsijournals.com/journals/acta-chimica-and-pharmaceutica-indica.html
Analytical Chemistry: An Indian Journal ,http://www.tsijournals.com/journals/analytical-chemistry-an-indian-journal.html
Archives in Chemical Research Open Access Journal,http://www.imedpub.com/archives-in-chemical-research/
Biopolymers Research ,https://www.omicsonline.org/biopolymers-research.php
Chemical Sciences Journal Open Access Journal,https://www.omicsonline.org/chemical-sciences-journal.php
Chemical Technology: An Indian Journal ,http://www.tsijournals.com/journals/chemical-technology-an-indian-journal.html
ChemXpress ,http://www.tsijournals.com/journals/chemxpress.html
Der Chemica Sinica ,http://www.imedpub.com/der-chemica-sinica/
Industrial Chemistry Open Access Journal,https://www.omicsonline.org/industrial-chemistry.php
Inorganic Chemistry: An Indian Journal ,http://www.tsijournals.com/journals/inorganic-chemistry-an-indian-journal.html
Insights in Analytical Electrochemistry Open Access Journal,http://electroanalytical.imedpub.com/
International Journal of Chemical Sciences Open Access Journal,http://www.tsijournals.com/journals/international-journal-of-chemical-sciences.html
Journal of Analytical & Bioanalytical Techniques Open Access Journal,https://www.omicsonline.org/analytical-bioanalytical-techniques.php
Journal of Chromatography & Separation Techniques Open Access Journal,https://www.omicsonline.org/chromatography-separation-techniques.php
Journal of Current Chemical and Pharmaceutical Sciences Open Access Journal,http://www.tsijournals.com/journals/journal-of-current-chemical-and-pharmaceutical-sciences.html
"Journal of Environmental Analytical Chemistry Open Access Journal, Association of Environmental Analytical Chemistry of India",https://www.omicsonline.org/environmental-analytical-chemistry.php
Journal of Health Care and Prevention ,https://www.omicsonline.org/journal-health-care-prevention.php
Journal of Organic & Inorganic Chemistry Open Access Journal,http://organic-inorganic.imedpub.com/
Journal of Pain & Relief Open Access Journal,https://www.omicsonline.org/pain-relief.php
Journal of Physical Chemistry & Biophysics Open Access Journal,https://www.omicsonline.org/physical-chemistry-biophysics.php
Journal of Phytochemistry & Biochemistry ,https://www.omicsonline.org/journal-phytochemistry-biochemistry.php
Mass Spectrometry & Purification Techniques Open Access Journal,https://www.omicsonline.org/mass-spectrometry-purification-techniques.php
Medicinal Chemistry Open Access Journal,https://www.omicsonline.org/medicinal-chemistry.php
Modern Chemistry & Applications Open Access Journal,https://www.omicsonline.org/modern-chemistry-applications.php
Natural Products Chemistry & Research Open Access Journal,https://www.omicsonline.org/natural-products-chemistry-research.php
Natural Products: An Indian Journal ,http://www.tsijournals.com/journals/natural-products-an-indian-journal.html
Organic Chemistry: An Indian Journal ,http://www.tsijournals.com/journals/organic-chemistry-an-indian-journal.html
Organic Chemistry: Current Research Open Access Journal,https://www.omicsonline.org/organic-chemistry-current-research.php
Pharmaceutical Analytical Chemistry Open Access Journal,https://www.omicsonline.org/pharmaceutical-analytical-chemistry.php
Physical Chemistry: An Indian Journal ,http://www.tsijournals.com/journals/physical-chemistry-an-indian-journal.html
Research & Reviews in Electrochemistry ,http://www.tsijournals.com/journals/research-reviews-in-electrochemistry.html
Research & Reviews in Polymer ,http://www.tsijournals.com/journals/research-reviews-in-polymer.html
Research & Reviews: Journal of Chemistry Open Access Journal,http://www.rroij.com/chemistry.php
RROIJ: Journal of Medicinal & Organic Chemistry Open Access Journal,http://www.rroij.com/medicinal-organic-chemistry.php
Scientific Reviews and Chemical Communications Open Access Journal,http://www.tsijournals.com/journals/scientific-reviews-and-chemical-communications.html
Structural Chemistry & Crystallography Communication Open Access Journal,http://structural-crystallography.imedpub.com/
Trends in Green Chemistry Open Access Journal,http://green-chemistry.imedpub.com/
Acute and Chronic Disease Reports ,https://www.omicsonline.org/acute-chronic-disease-reports.php
Annals of Clinical and Laboratory Research Open Access Journal,http://www.aclr.com.es/
Arrhythmia: Open Access Open Access Journal,http://www.openaccessjournals.com/journals/interventional-cardiology.html
Atherosclerosis: Open Access Open Access Journal,https://www.omicsonline.org/atherosclerosis.php
Cancer Biology and Therapeutic Oncology ,http://www.imedpub.com/cancer-biology-and-therapeutic-oncology/
Cancer Surgery Open Access Journal,https://www.omicsonline.org/cancer-surgery.php
Cardiovascular Investigations: Open Access ,http://www.imedpub.com/cardiovascular-investigations-open-access/
Cardiovascular Pharmacology: Open Access Open Access Journal,https://www.omicsonline.org/cardiovascular-pharmacology.php
Cardiovascular Therapy: Open Access Open Access Journal,https://www.omicsonline.org/cardiovascular-therapy.php
Clinical and Experimental Psychology Open Access Journal,https://www.omicsonline.org/clinical-experimental-psychology.php
Clinical Depression Open Access Journal,https://www.omicsonline.org/clinical-depression.php
Clinical Dermatology Research Journal ,https://www.scitechnol.com/clinical-dermatology-research-journal.php
Clinical Pediatrics: Open Access Open Access Journal,https://www.omicsonline.org/clinical-pediatrics.php
Clinical Practice (Therapy) Open Access Journal,http://www.openaccessjournals.com/journals/clinical-practice.html
Clinical Research on Foot & Ankle Open Access Journal,https://www.omicsonline.org/clinical-research-foot-ankle.php
Clinics in Mother and Child Health Open Access Journal,https://www.omicsonline.org/clinics-mother-child-health.php
Current Research: Cardiology Open Access Journal,http://www.pulsus.com/journals/current-research-cardiology.html
Diabetes Case Reports Open Access Journal,https://www.omicsonline.org/diabetes-case-reports.php
Insights in Pediatric Cardiology Open Access Journal,http://pediatric-cardiology.imedpub.com/
International Journal of Anesthesiology & Pain Medicine Open Access Journal,http://anaesthesia-painmedicine.imedpub.com/
International Journal of Cardiovascular Research Hybrid Open Access Journal,https://www.scitechnol.com/international-journal-of-cardiovascular-research.php
International Journal of Clinical & Medical Imaging Open Access Journal,http://www.imagejournals.org/
International Journal of Clinical Skills Open Access Journal,http://www.ijocs.org/
International Journal of Ophthalmic Pathology Hybrid Open Access Journal,https://www.scitechnol.com/international-journal-of-ophthalmic-pathology.php
Interventional Cardiology Open Access Journal,http://www.openaccessjournals.com/journals/interventional-cardiology.html
Interventional Cardiology Journal Open Access Journal,http://interventional-cardiology.imedpub.com/
JBR Journal of Clinical Diagnosis and Research Open Access Journal,https://www.omicsonline.org/clinical-diagnosis-research.php
JBR Journal of Interdisciplinary Medicine and Dental Science Open Access Journal,https://www.omicsonline.org/interdisciplinary-medicine-dental-science.php
Journal of Addictive Behaviors and Therapy Open Access Journal,http://www.imedpub.com/addictive-behaviors-and-therapy/
Journal of Anesthesia & Clinical Research Open Access Journal,https://www.omicsonline.org/anesthesia-clinical-research.php
Journal of Anesthesiology and Pain Research ,https://www.omicsonline.org/journal-anesthesiology-pain-research.php
Journal of Cardiovascular Diseases & Diagnosis Open Access Journal,https://www.omicsonline.org/cardiovascular-diseases-diagnosis.php
Journal of Cellular & Molecular Pathology Open Access Journal,http://cellular-molecular-pathology.imedpub.com/
Journal of Clinical & Experimental Cardiology Open Access Journal,https://www.omicsonline.org/clinical-experimental-cardiology.php
Journal of Clinical & Experimental Dermatology Research Open Access Journal,https://www.omicsonline.org/clinical-experimental-dermatology-research.php
Journal of Clinical & Experimental Nephrology Open Access Journal,http://clinical-experimental-nephrology.imedpub.com
Journal of Clinical & Experimental Oncology Hybrid Open Access Journal,https://www.scitechnol.com/clinical-experimental-oncology.php
"Journal of Clinical & Experimental Ophthalmology Open Access Journal, Official Journal of Afro-Asian Council of Ophthalmology",https://www.omicsonline.org/clinical-experimental-ophthalmology.php
Journal of Clinical & Experimental Orthopaedics Open Access Journal,http://orthopedics.imedpub.com/
Journal of Clinical & Experimental Pathology Open Access Journal,https://www.omicsonline.org/clinical-experimental-pathology.php
Journal of Clinical and Experimental Endocrinology ,https://www.omicsonline.org/journal-clinical-experimental-endocrionology.php
Journal of Clinical and Experimental Transplantation Open Access Journal,https://www.omicsonline.org/clinical-experimental-transplantation.php
Journal of Clinical and Medical Sciences ,https://www.omicsonline.org/clinical-medical-sciences.php
Journal of Clinical Case Reports Open Access Journal,https://www.omicsonline.org/clinical-case-reports.php
Journal of Clinical Diabetes ,https://www.omicsonline.org/journal-clinical-diabetes.php
Journal of Clinical Nutrition & Dietetics Open Access Journal,http://clinical-nutrition.imedpub.com/
Journal of Clinical Research ,https://www.omicsonline.org/journal-clinical-research.php
Journal of Clinical Research & Bioethics Open Access Journal,https://www.omicsonline.org/clinical-research-bioethics.php
Journal of Clinical Toxicology Open Access Journal,https://www.omicsonline.org/clinical-toxicology.php
Journal of Clinical Trials Open Access Journal,https://www.omicsonline.org/clinical-trials.php
Journal of Coronary Heart Diseases ,https://www.omicsonline.org/journal-coronary-heart-diseases.php
Journal of Cosmetology & Trichology Open Access Journal,https://www.omicsonline.org/cosmetology-trichology.php
Journal of Dental Science and Medicine Open Access Journal,https://www.omicsonline.org/dental-science-medicine.php
Journal of Dermatitis Open Access Journal,https://www.omicsonline.org/dermatitis.php
Journal of Eye & Cataract Surgery ,http://eye-cataract-surgery.imedpub.com/
Journal of Eye Diseases and Disorders Open Access Journal,https://www.omicsonline.org/eye-diseases-and-disorders.php
Journal of Genome ,https://www.omicsonline.org/journal-genome.php
Journal of Headache & Pain Management Open Access Journal,http://headache.imedpub.com/
Journal of Heart and Cardiovascular Research ,http://www.imedpub.com/heart-and-cardiovascular-research/
Journal of Heart Health and Circulation Open Access Journal,http://www.imedpub.com/heart-health-and-circulation/
Journal of Infectious Diseases & Preventive Medicine Open Access Journal,https://www.omicsonline.org/ancient-diseases-preventive-remedies.php
Journal of Interventional and General Cardiology ,https://www.omicsonline.org/journal-interventional-general-cardiology.php
Journal of Ocular Infection and Inflammation ,https://www.omicsonline.org/journal-ocular-infection-inflammation.php
Journal of Phonetics & Audiology Open Access Journal,https://www.omicsonline.org/phonetics-audiology.php
Journal of Reproductive Endocrinology & Infertility ,http://reproductive-endocrinology-infertility.imedpub.com/
Journal of Speech Pathology & Therapy Open Access Journal,https://www.omicsonline.org/speech-pathology-therapy.php
Journal of Surgery and Anesthesia Open Access Journal,https://www.omicsonline.org/surgery-anesthesia.php
Journal of Surgical Pathology and Diagnosis ,https://www.omicsonline.org/journal-surgical-pathology-diagnosis.php
Journal of Vasculitis Open Access Journal,https://www.omicsonline.org/vasculitis.php
Neonatal and Pediatric Medicine Open Access Journal,https://www.omicsonline.org/neonatal-and-pediatric-medicine.php
Optometry: Open Access Open Access Journal,https://www.omicsonline.org/optometry.php
Pediatric Dental Care Open Access Journal,https://www.omicsonline.org/pediatric-dental-care.php
Research and Reviews - Orthopedics ,http://www.rroij.com/orthopedics.php
Toxicology: Open Access Open Access Journal,https://www.omicsonline.org/toxicology.php
Transplant Reports : Open Access Open Access Journal,https://www.omicsonline.org/transplant-reports.php
Advances in Recycling & Waste Management Open Access Journal,https://www.omicsonline.org/advances-in-recycling-waste-management.php
Environment Pollution and Climate Change Open Access Journal,https://www.omicsonline.org/environment-pollution-climate-change.php
Expert Opinion On Environmental Biology Hybrid Open Access Journal,https://www.scitechnol.com/expert-opinion-on-environmental-biology.php
"Hydrology: Current Research Open Access Journal, Official Journal of Slovak Society of Medical Genetics",https://www.omicsonline.org/hydrology-current-research.php
International Journal of Waste Resources Open Access Journal,https://www.omicsonline.org/international-journal-waste-resources.php
Journal of Biodiversity & Endangered Species Open Access Journal,https://www.omicsonline.org/biodiversity-endangered-species.php
Journal of Biodiversity Management & Forestry Hybrid Open Access Journal,https://www.scitechnol.com/biodiversity-management-forestry.php
"Journal of Biodiversity, Bioprospecting and Development Open Access Journal",https://www.omicsonline.org/international-journal-of-biodiversity-bioprocessing-and-development.php
Journal of Bioremediation & Biodegradation Open Access Journal,https://www.omicsonline.org/bioremediation-biodegradation.php
Journal of Climatology & Weather Forecasting Open Access Journal,https://www.omicsonline.org/climatology-weather-forecasting.php
Journal of Ecosystem & Ecography Open Access Journal,https://www.omicsonline.org/ecosystem-ecography.php
Journal of Environmental & Analytical Toxicology Open Access Journal,https://www.omicsonline.org/environmental-analytical-toxicology.php
Journal of Fundamentals of Renewable Energy and Applications Open Access Journal,https://www.omicsonline.org/fundamentals-renewable-energy-applications.php
Journal of Industrial Pollution Control Open Access Journal,http://www.icontrolpollution.com/
Journal of Petroleum & Environmental Biotechnology Open Access Journal,https://www.omicsonline.org/petroleum-environmental-biotechnology.php
Journal of Pollution ,https://www.omicsonline.org/journal-pollution.php
Journal of Pollution Effects & Control Open Access Journal,https://www.omicsonline.org/pollution-and-effects.php
Research & Reviews: Journal of Ecology and Environmental Sciences Open Access Journal,http://www.rroij.com/ecology-and-environmental-sciences.php
"Resources, Recycling and Waste Management ",http://www.imedpub.com/resources-recycling-and-waste-management/
Advances in Automobile Engineering Open Access Journal,https://www.omicsonline.org/advances-in-automobile-engineering.php
Advances in Robotics & Automation Open Access Journal,https://www.omicsonline.org/advances-in-robotics-automation.php
"Bioceramics Development and Applications Open Access Journal, Official Journal of International Society for Ceramics in Medicine",https://www.omicsonline.org/bioceramics-development-applications.php
Biosensors Journal Open Access Journal,https://www.omicsonline.org/biosensors-journal.php
European Journal of Applied Engineering and Scientific Research Open Access Journal,http://www.scholarsresearchlibrary.com/journals/european-journal-of-applied-engineering-and-scientific-research/
Global Journal of Technology and Optimization Open Access Journal,https://www.omicsonline.org/global-journal-technology-optimization.php
Industrial Engineering & Management Open Access Journal,https://www.omicsonline.org/industrial-engineering-management.php
Innovative Energy & Research Open Access Journal,https://www.omicsonline.org/innovative-energy-policies.php
"International Journal of Advance Innovations, Thoughts & Ideas Open Access Journal",https://www.omicsonline.org/international-journal-advance-innovations-thoughts-ideas.php
