Dental Health: Current Research Hybrid Open Access Journal,https://www.scitechnol.com/dental-health-current-research.php
"Dentistry Open Access Journal, Official Journal of Alexandria Oral Implantology Association, London School of Facial Orthotropics",https://www.omicsonline.org/dentistry.php
Dermatology and Dermatologic Diseases Open Access Journal,https://www.omicsonline.org/pigmentary-disorders-open-access.php
Dermatology Case Reports Open Access Journal,https://www.omicsonline.org/dermatology-case-reports.php
Diagnostic Pathology: Open Access Open Access Journal,https://www.omicsonline.org/diagnostic-pathology.php
Emergency Medicine: Open Access Official Journal of World Federation of Pediatric Intensive and Critical Care societies,https://www.omicsonline.org/emergency-medicine.php
Endocrinology & Diabetes Research Hybrid Open Access Journal,https://www.scitechnol.com/endocrinology-and-diabetes-research.php
Endocrinology & Metabolic Syndrome Official Journal of PCOS Awareness Association,https://www.omicsonline.org/endocrinology-metabolic-syndrome.php
Endocrinology Research and Metabolism ,http://www.imedpub.com/endocrinology-research-and-metabolism/
Epidemiology: Open Access Open Access Journal,https://www.omicsonline.org/epidemiology-open-access.php
European Journal of Sports and Exercise Science ,http://www.scholarsresearchlibrary.com/journals/european-journal-of-sports-exercise-science/
Evidence based medicine and practice Open Access Journal,https://www.omicsonline.org/evidence-based-medicine-practice.php
Family Medicine & Medical Science Research Open Access Journal,https://www.omicsonline.org/family-medicine-medical-science-research.php
General Medicine: Open Access Open Access Journal,https://www.omicsonline.org/general-medicine.php
"Gynecology & Obstetrics Open Access Journal, Official Journal of PCOS Awareness Association",https://www.omicsonline.org/gynecology-obstetrics.php
Gynecology & Obstetrics Case report Open Access Journal,http://gynecology-obstetrics.imedpub.com/
Hair Therapy & Transplantation Open Access Journal,https://www.omicsonline.org/hair-therapy-transplantation.php
Head and Neck Cancer Research Open Access Journal,http://head-and-neck-cancer-research.imedpub.com
Hepatology and Pancreatic Science ,https://www.omicsonline.org/hepatology-pancreatic-science.php
Herbal Medicine: Open Access Open Access Journal,http://herbal-medicine.imedpub.com/
Imaging in Medicine Open Access Journal,http://www.openaccessjournals.com/journals/imaging-in-medicine.html
Insights in Blood Pressure Open Access Journal,http://blood-pressure.imedpub.com
Insights in Chest Diseases Open Access Journal,http://insightsinchestdiseases.imedpub.com/
Insights in Gynecologic Oncology Open Access Journal,https://www.omicsonline.org/gynecologic-oncology.php
Internal Medicine: Open Access Open Access Journal,https://www.omicsonline.org/internal-medicine.php
International Journal of Digestive Diseases Open Access Journal,http://digestive-diseases.imedpub.com/
International Journal of Physical Medicine & Rehabilitation Open Access Journal,https://www.omicsonline.org/physical-medicine-rehabilitation.php
JOP. Journal of the Pancreas Open Access Journal,http://pancreas.imedpub.com/
Journal of Adenocarcinoma Open Access Journal,http://adenocarcinoma.imedpub.com/
Journal of Aesthetic & Reconstructive Surgery Open Access Journal,http://aesthetic-reconstructive-surgery.imedpub.com/
Journal of Aging and geriatric psychiatry ,http://www.alliedacademies.org/aging-and-geriatric-psychiatry/
Journal of Arthritis Open Access Journal,https://www.omicsonline.org/arthritis.php
Journal of Athletic Enhancement Hybrid Open Access Journal,https://www.scitechnol.com/athletic-enhancement.php
Journal of Autacoids and Hormones ,https://www.omicsonline.org/autacoids-and-hormones.php
Journal of Blood & Lymph Open Access Journal,https://www.omicsonline.org/blood-lymph.php
"Journal of Blood Disorders & Transfusion Open Access Journal, Official Journal of Thalassaemia International Federation",https://www.omicsonline.org/blood-disorders-transfusion.php
Journal of Blood Research & Hematologic Diseases Open Access Journal,https://www.scitechnol.com/journal-of-blood-research-and-hematologic-diseases.php
Journal of Bone Reports & Recommendations Open Access Journal,http://bone.imedpub.com/
Journal of Bone Research Open Access Journal,https://www.omicsonline.org/bone-marrow-research.php
Journal of Cancer Clinical Trials Open Access Journal,https://www.omicsonline.org/cancer-clinical-trials.php
Journal of Cancer Diagnosis Open Access Journal,https://www.omicsonline.org/cancer-diagnosis.php
Journal of Cancer Research and Immuno-Oncology Open Access Journal,https://www.omicsonline.org/cancer-research-immuno-oncology.php
Journal of Cancer Science & Therapy Official Journal of European Biotechnology Thematic Network Association,https://www.omicsonline.org/cancer-science-therapy.php
Journal of Cancer Science and Research Open Access Journal,https://www.omicsonline.org/journal-cancer-science-and-research.php
Journal of Carcinogenesis & Mutagenesis Open Access Journal,https://www.omicsonline.org/carcinogenesis-mutagenesis.php
Journal of Cardiac and Pulmonary Rehabilitation ,https://www.omicsonline.org/cardiac-pulmonary-rehabilitation.php
Journal of Cell Science and Apoptosis ,https://www.omicsonline.org/cell-science-apoptosis.php
Journal of Childhood & Developmental Disorders Open Access Journal,http://childhood-developmental-disorders.imedpub.com/
Journal of Childhood Obesity Open Access Journal,http://childhood-obesity.imedpub.com
Journal of Clinical and Medical Case Studies ,http://www.rroij.com/clinical-and-medical-case-studies.php
Journal of Clinical and Molecular Endocrinology Open Access Journal,http://clinical-and-molecular-endocrinology.imedpub.com
Journal of Clinical Anesthesiology: Open Access ,https://www.omicsonline.org/journal-clinical-anesthesiology.php
Journal of Clinical Immunology and Allergy Open Access Journal,http://asthma-and-bronchitis.imedpub.com/
Journal of Clinical Microbiology and Antimicrobials ,https://www.omicsonline.org/journal-clinical-microbiology-antimicrobials.php
Journal of Clinical Respiratory Diseases and Care Open Access Journal,https://www.omicsonline.org/clinical-respiratory-diseases-and-care.php
"Journal of Communication Disorders, Deaf Studies & Hearing Aids Open Access Journal",https://www.omicsonline.org/deaf-studies-hearing-aids.php
Journal of Congenital Disorders ,https://www.omicsonline.org/congenital-disorders.php
Journal of Contraceptive Studies Open Access Journal,http://contraceptivestudies.imedpub.com/
Journal of Dental Pathology and Medicine ,https://www.omicsonline.org/journal-dental-pathology-medicine.php
Journal of Diabetes & Metabolism Official Journal of European Biotechnology Thematic Network Association,https://www.omicsonline.org/diabetes-metabolism.php
Journal of Diabetic Complications & Medicine Open Access Journal,https://www.omicsonline.org/diabetic-complications-medicine.php
Journal of Ecology and Toxicology Open Access Journal,https://www.omicsonline.org/ecology-toxicology.php
Journal of Forensic Medicine Open Access Journal,https://www.omicsonline.org/journal-forensic-medicine.php
Journal of Gastrointestinal & Digestive System Open Access Journal,https://www.omicsonline.org/gastrointestinal-digestive-system.php
Journal of Gastrointestinal Cancer and Stromal Tumors Open Access Journal,https://www.omicsonline.org/gastrointestinal-cancer-stromal-tumors.php
Journal of General Practice Open Access Journal,https://www.omicsonline.org/general-practice.php
Journal of Genital System & Disorders Hybrid Open Access Journal,https://www.scitechnol.com/genital-system-disorders.php
Journal of Gerontology & Geriatric Research Open Access Journal,https://www.omicsonline.org/gerontology-geriatric-research.php
Journal of Heavy Metal Toxicity and Diseases Open Access Journal,http://heavy-metal-toxicity-diseases.imedpub.com/
Journal of Hematology & Thromboembolic Diseases Open Access Journal,https://www.omicsonline.org/haematology-thromboembolic-diseases.php
Journal of Hepatitis Open Access Journal,http://hepatitis.imedpub.com
Journal of Hepatology and Gastrointestinal disorders Open Access Journal,https://www.omicsonline.org/hepatology-gastrointestinal-disorders.php
Journal of HPV and Cervical Cancer Open Access Journal,https://www.omicsonline.org/cervical-cancer.php
"Journal of Hypertension: Open Access Open Access Journal, Official Journal of Slovak League against Hypertension",https://www.omicsonline.org/hypertension-open-access.php
Journal of Imaging and Interventional Radiology Open Access Journal,http://interventional-radiology.imedpub.com/
Journal of Integrative Oncology Open Access Journal,https://www.omicsonline.org/integrative-oncology.php
Journal of Kidney Open Access Journal,https://www.omicsonline.org/kidney.php
Journal of Leukemia Open Access Journal,https://www.omicsonline.org/leukemia.php
Journal of Liver Open Access Journal,https://www.omicsonline.org/liver.php
Journal of Liver: Disease & Transplantation Hybrid Open Access Journal,https://www.scitechnol.com/liver-disease-transplantation.php
Journal of Lung Cancer Diagnosis & Treatment Open Access Journal,https://www.omicsonline.org/lung-cancer-diagnosis-treatment.php
Journal of Lung Diseases & Treatment Open Access Journal,https://www.omicsonline.org/lung-diseases-treatment.php
Journal of Medical & Surgical Pathology Open Access Journal,https://www.omicsonline.org/medical-surgical-pathology.php
Journal of Medical Diagnostic Methods Open Access Journal,https://www.omicsonline.org/medical-diagnostic-methods.php
Journal of Medical Implants & Surgery Open Access Journal,https://www.omicsonline.org/medical-implants-surgery.php
Journal of Medical Oncology and Therapeutics ,http://www.alliedacademies.org/medical-oncology-therapeutics/
Journal of Medical Physics and Applied Sciences Open Access Journal,http://medicalphysics.imedpub.com/
Journal of Medical Physiology & Therapeutics ,https://www.omicsonline.org/medical-physiology-therapeutics.php
Journal of Medical Research & Health Education ,http://www.imedpub.com/medical-research-and-health-education/
Journal of Medical Toxicology and Clinical Forensic Medicine Open Access Journal,http://toxicology.imedpub.com/
Journal of Metabolic Syndrome Open Access Journal,https://www.omicsonline.org/metabolic-syndrome.php
Journal of Microbiology and Pathology ,https://www.omicsonline.org/journal-microbiology-pathology.php
Journal of Molecular Histology & Medical Physiology Open Access Journal,https://www.omicsonline.org/molecular-histology-medical-physiology.php
Journal of Morphology and Anatomy ,https://www.omicsonline.org/morphology-anatomy.php
Journal of MPE Molecular Pathological Epidemiology Open Access Journal,http://molecular-pathological-epidemiology.imedpub.com/
Journal of Neonatal Biology Open Access Journal,https://www.omicsonline.org/neonatal-biology.php
Journal of Neoplasm Open Access Journal,http://neoplasm.imedpub.com/
Journal of Nephrology & Renal Diseases Open Access Journal,https://www.scitechnol.com/nephrology-renal-diseases.php
Journal of Nephrology & Therapeutics Open Access Journal,https://www.omicsonline.org/nephrology-therapeutics.php
Journal of Novel Physiotherapies Open Access Journal,https://www.omicsonline.org/novel-physiotherapies.php
Journal of Nuclear Medicine & Radiation Therapy Open Access Journal,https://www.omicsonline.org/nuclear-medicine-radiation-therapy.php
Journal of Nutritional Disorders & Therapy Open Access Journal,https://www.omicsonline.org/nutritional-disorders-therapy.php
Journal of Obesity & Eating Disorders Open Access Journal,http://obesity.imedpub.com/
Journal of Obesity & Therapeutics Open Access Journal,https://www.scitechnol.com/obesity-therapeutics.php
Journal of Obesity & Weight Loss Therapy Open Access Journal,https://www.omicsonline.org/obesity-weight-loss-therapy.php
Journal of Obesity and Metabolism ,https://www.omicsonline.org/journal-obesity-metabolism.php
Journal of Odontology ,https://www.omicsonline.org/journal-odontology.php
Journal of Oncology Medicine & Practice Open Access Journal,https://www.omicsonline.org/oncology-medicine-practice.php
Journal of Oncology Research and Treatment Open Access Journal,https://www.omicsonline.org/advances-oncology-research-and-treatments.php
Journal of Oncology Translational Research Open Access Journal,https://www.omicsonline.org/guidelines-oncology-translational-research.php
"Journal of Oral Hygiene & Health Open Access Journal, Official Journal of Alexandria Oral Implantology Association, London School of Facial Orthotropics",https://www.omicsonline.org/oral-hygiene-and-health.php
Journal of Orthodontics & Endodontics Open Access Journal,http://orthodontics-endodontics.imedpub.com/
Journal of Orthopedic Oncology Open Access Journal,https://www.omicsonline.org/orthopedic-oncology.php
Journal of Osteoarthritis Open Access Journal,https://www.omicsonline.org/osteoarthritis.php
Journal of Osteoporosis and Physical Activity Open Access Journal,https://www.omicsonline.org/osteoporosis-and-physical-activity.php
Journal of Otology & Rhinology Hybrid Open Access Journal,https://www.scitechnol.com/otology-rhinology.php
Journal of Paediatric Medicine & Surgery ,https://www.omicsonline.org/paediatric-medicine-surgery.php
Journal of Pain Management & Medicine Open Access Journal,https://www.omicsonline.org/pain-management-medicine.php
Journal of Palliative Care & Medicine Open Access Journal,https://www.omicsonline.org/palliative-care-medicine.php
Journal of Perioperative Medicine ,https://www.omicsonline.org/journal-perioperative-medicine.php
Journal of Physiotherapy & Physical Rehabilitation Open Access Journal,https://www.omicsonline.org/physiotherapy-physical-rehabilitation.php
Journal of Pituitary Research & Treatment ,https://www.omicsonline.org/pituitary-research-treatment.php
Journal of Pregnancy and Child Health Open Access Journal,https://www.omicsonline.org/pregnancy-and-child-health.php
Journal of Preventive Medicine Open Access Journal,http://preventive-medicine.imedpub.com
Journal of Prostate Cancer Open Access Journal,https://www.omicsonline.org/prostate-cancer.php
Journal of Pulmonary & Respiratory Medicine Open Access Journal,https://www.omicsonline.org/pulmonary-respiratory-medicine.php
Journal of Pulmonary Medicine Open Access Journal,https://www.scitechnol.com/pulmonary-medicine.php
Journal of Pulmonology and Respiratory Diseases ,https://www.omicsonline.org/pulmonology-respiratory-diseases.php
Journal of Rare Disorders: Diagnosis & Therapy ,http://raredisorders.imedpub.com/
Journal of Regenerative Medicine Hybrid Open Access Journal,https://www.scitechnol.com/regenerative-medicine.php
Journal of Sexual & Reproductive Medicine subscription,http://www.pulsus.com/journals/sexual-reproductive-medicine.html
Journal of Sports Medicine & Doping Studies Open Access Journal,https://www.omicsonline.org/sports-medicine-doping-studies.php
Journal of Steroids & Hormonal Science Open Access Journal,https://www.omicsonline.org/steroids-hormonal-science.php
Journal of Surgery and Emergency Medicine Open Access Journal,http://www.imedpub.com/surgery-and-emergency-medicine/
Journal of Surgery [Jurnalul de Chirurgie] Open Access Journal,https://www.omicsonline.org/surgery.php
Journal of Thrombosis and Circulation: Open Access Open Access Journal,https://www.omicsonline.org/thrombosis-circulation-open-access.php
Journal of Thyroid Disorders & Therapy Open Access Journal,https://www.omicsonline.org/thyroid-disorders-therapy.php
Journal of Traditional Medicine & Clinical Naturopathy Open Access Journal,https://www.omicsonline.org/homeopathy-ayurvedic-medicine.php
Journal of Transplantation Technologies & Research Open Access Journal,https://www.omicsonline.org/transplantation-technologies-research.php
Journal of Trauma & Treatment Open Access Journal,https://www.omicsonline.org/trauma-treatment.php
Journal of Trauma and Critical Care ,http://www.alliedacademies.org/trauma-and-critical-care/
Journal of Tumor Research Open Access Journal,https://www.omicsonline.org/tumor-diagnostics-reports.php
Journal of Tumour Research & Reports Open Access Journal,https://www.omicsonline.org/journal-tumour-research-reports.php
Journal of Vascular and Endovascular Therapy Open Access Journal,http://vascular-endovascular-therapy.imedpub.com
Journal of Vascular Medicine & Surgery Open Access Journal,https://www.omicsonline.org/vascular-medicine-surgery.php
"Journal of Womens Health, Issues and Care Hybrid Open Access Journal",https://www.scitechnol.com/womens-health-issues-care.php
"Journal of Yoga & Physical Therapy Open Access Journal, Official Journal of Yoga Federation of Russia and Hong Kong Yoga Association",https://www.omicsonline.org/yoga-physical-therapy.php
Malaria Control & Elimination Open Access Journal,https://www.omicsonline.org/malaria-chemotherapy-control-elimination.php
Maternal and pediatric nutrition Open Access Journal,https://www.omicsonline.org/maternal-pediatric-nutrition.php
Medical & Clinical Reviews Open Access Journal,http://medical-clinical-reviews.imedpub.com
Medical & Surgical Urology Open Access Journal,https://www.omicsonline.org/medical-surgical-urology.php
Medical case reports Open Access Journal,http://medical-case-reports.imedpub.com/
Medical Reports & Case Studies open-access,https://www.omicsonline.org/medical-reports-case-studies.php
Neuro-oncology: Open Access Open Access Journal,http://j-neurooncology.imedpub.com
Occupational Medicine & Health Affairs Open Access Journal,https://www.omicsonline.org/occupational-medicine-health-affairs.php
OMICS Journal of Radiology Open Access Journal,https://www.omicsonline.org/radiology.php
Oncology & Cancer Case Reports Open Access Journal,https://www.omicsonline.org/oncology-cancer-case-reports.php
Oral Health and Dental Management Open Access Journal Official Journal of London School of Facial Orthotropics,https://www.omicsonline.org/oral-health-dental-management.php
Oral Health Case Reports Open Access Journal,https://www.omicsonline.org/oral-health-case-reports.php
Orthopedic & Muscular System: Current Research Open Access Journal,https://www.omicsonline.org/orthopedic-muscular-system-current-research.php
Otolaryngology: Open Access Open Access Journal,https://www.omicsonline.org/otolaryngology-open-access.php
Pancreatic Disorders & Therapy Open Access Journal,https://www.omicsonline.org/pancreatic-disorders-therapy.php
Pediatric Care Open Access Journal,http://pediatrics.imedpub.com/
Pediatric Emergency Care and Medicine: Open Access Open Access Journal,http://pediatric-emergency-care.imedpub.com/
Pediatrics & Health Research ,http://www.imedpub.com/pediatrics-and-health-research/
Pediatrics & Therapeutics Open Access Journal,https://www.omicsonline.org/pediatrics-therapeutics.php
Periodontics and Prosthodontics Open Access Journal,http://periodontics-prosthodontics.imedpub.com/
Reconstructive Surgery & Anaplastology Open Access Journal,https://www.omicsonline.org/anaplastology.php
Reports in Cancer and Treatment ,http://www.rroij.com/reports-in-cancer-and-treatment.php
Reports in Disease Markers ,https://www.omicsonline.org/reports-in-disease-markers.php
Reports in Thyroid Research ,https://www.omicsonline.org/reports-thyroid-research.php
Reproductive System & Sexual Disorders: Current Research Open Access Journal,https://www.omicsonline.org/reproductive-system-sexual-disorders.php
Research & Reviews: Journal of Dental Sciences Open Access Journal,http://www.rroij.com/dental-sciences.php
Research & Reviews: Medical and Clinical Oncology ,http://www.rroij.com/medical-and-clinical-oncology.php
Research and Reports in Gastroenterology Open Access Journal,https://www.scitechnol.com/research-reports-gastroenterology.php
Research and Reports in Gynecology and Obstetrics ,http://www.alliedacademies.org/research-and-reports-in-gynecology-and-obstetrics/
Research and Reports in Medical Sciences Open Access Journal,https://www.omicsonline.org/research-and-reports-medical-sciences.php
Skin diseases & Skin Care Open Access Journal,http://skin-diseases-and-skin-care.imedpub.com/
Surgery: Current Research Official Journal of European Society of Aesthetic Surgery,https://www.omicsonline.org/surgery-current-research.php
Translational Medicine Open Access Journal,https://www.omicsonline.org/translational-medicine.php
Trauma & Acute Care Open Access Journal,http://trauma-acute-care.imedpub.com/
Tropical Medicine & Surgery Open Access Journal,https://www.omicsonline.org/tropical-medicine-and-surgery.php
Universal Surgery Open Access Journal,http://www.jusurgery.com/
World Journal of Pharmacology and Toxicology ,https://www.omicsonline.org/world-journal-of-pharmacology-toxicology.php
Abnormal and Behavioural Psychology Open Access Journal,https://www.omicsonline.org/abnormal-behavioural-psychology.php
Acta Psychopathologica Open Access Journal,http://psychopathology.imedpub.com/
Annals of Behavioural Science Open Access Journal,http://behaviouralscience.imedpub.com/
Autism-Open Access Official Journal of Autism Community Network,https://www.omicsonline.org/autism.php
Bipolar Disorder: Open Access Open Access Journal,https://www.omicsonline.org/bipolar-disorder.php
"Brain Disorders & Therapy Open Access Journal, Official Journal of Bulgarian Society of Neurology (Europe)",https://www.omicsonline.org/brain-disorders-therapy.php
Canadian IONM News Open Access Journal,http://www.andrewjohnpublishing.com/canadian-ionm-news/
Clinical Neuropsychology: Open Access Open Access Journal,https://www.omicsonline.org/clinical-neuropsychology.php
Clinical Psychiatry Open Access Journal,http://clinical-psychiatry.imedpub.com/
Dual Diagnosis: Open Access Open Access Journal,http://dual-diagnosis.imedpub.com
Epilepsy Journal Open Access Journal,https://www.omicsonline.org/epilepsy.php
Insights in Neurosurgery Open Access Journal,http://neurosurgery.imedpub.com/
Integrative Neuroscience Research ,http://www.alliedacademies.org/integrative-neuroscience-research/
International Journal of Emergency Mental Health and Human Resilience Open Access Journal,https://www.omicsonline.org/international-journal-of-emergency-mental-health-and-human-resilience.php
International Journal of Mental Health & Psychiatry Hybrid Open Access Journal,https://www.scitechnol.com/international-journal-of-mental-health-and-psychiatry.php
International Journal of Neurorehabilitation Open Access Journal,https://www.omicsonline.org/international-journal-of-neurorehabilitation.php
International Journal of School and Cognitive Psychology Open Access Journal,https://www.omicsonline.org/school-cognitive-psychology.php
Journal of Addiction Research & Therapy Open Access Journal,https://www.omicsonline.org/addiction-research-therapy.php
"Journal of Addictive Behaviors, Therapy & Rehabilitation Hybrid Open Access Journal",https://www.scitechnol.com/addictive-behaviors-therapy-rehabilitation.php
Journal of Alcoholism & Drug Dependence Official Journal of International Society of Addiction Medicine,https://www.omicsonline.org/alcoholism-and-drug-dependence.php
Journal of Alzheimers Disease & Parkinsonism Open Access Journal,https://www.omicsonline.org/alzheimers-disease-parkinsonism.php
Journal of Child and Adolescent Behaviour Open Access Journal,https://www.omicsonline.org/child-and-adolescent-behavior.php
Journal of Clinical & Experimental Neuroimmunology Open Access Journal,https://www.omicsonline.org/clinical-experimental-neuroimmunology.php
Journal of Clinical Neurology and Neurosurgery ,https://www.omicsonline.org/-journal-clinical-neurology-neurosurgery.php
Journal of Dementia ,https://www.omicsonline.org/journal-dementia.php
Journal of Depression and Anxiety Open Access Journal,https://www.omicsonline.org/depression-and-anxiety.php
Journal of Drug Abuse Open Access Journal,http://drugabuse.imedpub.com/
Journal of Forensic Psychology Open Access Journal,https://www.omicsonline.org/forensic-psychology.php
Journal of Mental Disorders and Treatment Open Access Journal,https://www.omicsonline.org/mental-disorders-treatment.php
Journal of Multiple Sclerosis Open Access Journal,https://www.omicsonline.org/multiple-sclerosis-open-access.php
Journal of Neuroinfectious Diseases Open Access Journal,https://www.omicsonline.org/neuroinfectious-diseases.php
Journal of Neuroinformatics and Neuroimaging ,http://www.alliedacademies.org/neuroinformatics-and-neuroimaging/
"Journal of Neurological Disorders Open Access Journal, Official Journal of Bulgarian Society of Neurology (Europe)",https://www.omicsonline.org/neurological-disorders.php
"Journal of Neurology & Neurophysiology Open Access Journal, Official Journal of Bulgarian Society of Neurology (Europe)",https://www.omicsonline.org/neurology-neurophysiology.php
Journal of Neurology and Neuroscience Open Access Journal,http://www.jneuro.com/
Journal of Neuropsychiatry Open Access Journal,http://neuropsychiatry.imedpub.com/
Journal of Neuroscience & Clinical Research Hybrid Open Access Journal,https://www.scitechnol.com/journal-of-neuroscience-and-clinical-research.php
Journal of Neuroscience and Neuropharmacology Open Access Journal,https://www.omicsonline.org/neurochemistry-neuropharmacology.php
Journal of Pediatric Neurological Disorders Open Access Journal,https://www.omicsonline.org/pediatric-neurological-disorders.php
Journal of Pediatric Neurology and Medicine Open Access Journal,https://www.omicsonline.org/pediatric-neurology.php
Journal of Psychiatry Open Access Journal,https://www.omicsonline.org/journal-of-psychiatry.php
Journal of Psychological Abnormalities Open Access Journal,https://www.omicsonline.org/psychological-abnormalities.php
"Journal of Psychology & Psychotherapy Open Access Journal, Official Journal of Psychology and Psychiatry for Adults & Children Association",https://www.omicsonline.org/psychology-psychotherapy.php
