Journal of Sleep Disorders & Therapy Open Access Journal,https://www.omicsonline.org/sleep-disorders-therapy.php
Journal of Sleep Disorders : Treatment and Care Hybrid Open Access Journal,https://www.scitechnol.com/sleep-disorders-treatment-care.php
Journal of Spine Open Access Journal,https://www.omicsonline.org/spine.php
Journal of Spine & Neurosurgery Hybrid Open Access Journal,https://www.scitechnol.com/spine-neurosurgery.php
Journal of Translational Neurosciences Open Access Journal,http://translational-neuroscience.imedpub.com/
Journal of Traumatic Stress Disorders & Treatment Hybrid Open Access Journal,https://www.scitechnol.com/traumatic-stress-disorders-treatment.php
Neuroscience and Psychiatry: Open Access ,https://www.omicsonline.org/neuroscience-psychiatry.php
Research & Reviews: Neuroscience Open Access Journal,http://www.rroij.com/neuroscience.php
Spine Research Open Access Journal,http://spine.imedpub.com/
Stroke Research & Therapy Open Access Journal,http://stroke.imedpub.com/
The Neurologist: Clinical & Therapeutics Journal ,https://www.omicsonline.org/neurologist-clinical-therapeutics-journal.php
Advanced Practices in Nursing Open Access Journal,https://www.omicsonline.org/advanced-practices-nursing.php
Aerobics & Fitness Open Access Journal,https://www.omicsonline.org/aerobics-and-fitness.php
Diversity & Equality in Health and Care Open Access Journal,http://diversityhealthcare.imedpub.com/
Global Journal of Nursing & Forensic Studies Open Access Journal,https://www.omicsonline.org/global-journal-nursing-forensic-studies.php
Health & Medical Economics Open Access Journal,http://health-medical-economics.imedpub.com/
Health Care : Current Reviews Open Access Journal,https://www.omicsonline.org/health-care-reviews.php
Health Economics & Outcome Research: Open Access Open Access Journal,https://www.omicsonline.org/health-economics-outcome-research.php
Health Science Journal Open Access Journal,http://www.hsj.gr/
Health Systems and Policy Research Open Access Journal,http://www.hsprj.com/
Hospital & Medical Management Open Access Journal,http://hospital-medical-management.imedpub.com/
International Journal of Collaborative Research on Internal Medicine & Public Health Open Access Journal,http://internalmedicine.imedpub.com/
International Journal of Public Health and Safety Open Access Journal,https://www.omicsonline.org/public-health-safety.php
Journal of Community & Public Health Nursing Open Access Journal,https://www.omicsonline.org/community-public-health-nursing.php
Journal of Community Medicine & Health Education Open Access Journal,https://www.omicsonline.org/community-medicine-health-education.php
"Journal of Health Education Research & Development Open Access Journal, Official Journal of National Biosafety Association (ANBio)",https://www.omicsonline.org/health-education-research-and-development.php
Journal of Healthcare Communications Open Access Journal,http://healthcare-communications.imedpub.com/
Journal of Intensive and Critical Care Open Access Journal,http://criticalcare.imedpub.com/
Journal of Nursing & Care Open Access Journal,https://www.omicsonline.org/nursing-care.php
Journal of Patient Care Open Access Journal,https://www.omicsonline.org/patient-care.php
Journal of Perioperative & Critical Intensive Care Nursing Open Access Journal,https://www.omicsonline.org/critical-intesive-care-nursing.php
Journal of Physiotherapy Research ,http://www.imedpub.com/journal-physiotherapy-research/
Journal of Women's Health Care Open Access Journal,https://www.omicsonline.org/womens-health-care.php
Medical Safety & Global Health Open Access Journal,https://www.omicsonline.org/medical-safety-global-health.php
Primary Healthcare: Open Access Open Access Journal,https://www.omicsonline.org/primary-health-care-open-access.php
Quality in Primary Care Open Access Journal,http://primarycare.imedpub.com/
Research & Reviews: Journal of Medical and Health Sciences Open Access Journal,http://www.rroij.com/medical-and-health-sciences.php
Research & Reviews: Journal of Nursing and Health Sciences Open Access Journal,http://www.rroij.com/nursing-and-health-sciences.php
Advances in Pharmacoepidemiology & Drug Safety Open Access Journal,https://www.omicsonline.org/advances-in-pharmacoepidemiology-drug-safety.php
American Journal of Advanced Drug Delivery Open Access Journal,http://www.imedpub.com/advanced-drug-delivery/
American Journal of Drug Delivery and Therapeutics ,http://www.imedpub.com/drug-delivery-and-therapeutics/
American Journal of Pharmacology and Pharmacotherapeutics ,http://www.imedpub.com/pharmacology-and-pharmacotherapeutics/
Biochemistry & Pharmacology: Open Access Journal Open Access Journal,https://www.omicsonline.org/biochemistry-pharmacology-open-access.php
Biomarkers Journal Open Access Journal,http://biomarkers.imedpub.com/
Clinical Pharmacology & Biopharmaceutics Open Access Journal,https://www.omicsonline.org/clinical-pharmacology-biopharmaceutics.php
Clinical Pharmacology and Pharmacodynamics ,http://www.imedpub.com/clinical-pharmacology-and-pharmacodynamics/
Der Pharmacia Sinica ,http://www.imedpub.com/der-pharmacia-sinica/
Drug Designing: Open Access Open Access Journal,https://www.omicsonline.org/drug-designing.php
International Journal of Drug Development & Research Open Access Journal,http://www.ijddr.in/
International Journal of Research and Development in Pharmacy & Life Sciences Open Access Journal,https://www.omicsonline.org/research-and-development-in-pharmacy.php
Journal of Applied Pharmacy Open Access Journal,https://www.omicsonline.org/applied-pharmacy.php
Journal of Bioanalysis & Biomedicine Open Access Journal,https://www.omicsonline.org/bioanalysis-biomedicine.php
Journal of Bioequivalence & Bioavailability Official Journal of Association of Contract Research Organisations,https://www.omicsonline.org/bioequivalence-bioavailability.php
Journal of Clinical & Experimental Pharmacology Open Access Journal,https://www.omicsonline.org/clinical-experimental-pharmacology.php
Journal of Developing Drugs Open Access Journal,https://www.omicsonline.org/developing-drugs.php
Journal of Drug Metabolism & Toxicology Open Access Journal,https://www.omicsonline.org/drug-metabolism-toxicology.php
Journal of Forensic Toxicology & Pharmacology Hybrid Open Access Journal,https://www.scitechnol.com/forensic-toxicology-pharmacology.php
Journal of Formulation Science & Bioavailability ,https://www.omicsonline.org/formulation-science-bioavailability.php
Journal of Molecular Pharmaceutics & Organic Process Research Open Access Journal,https://www.omicsonline.org/molecular-pharmaceutics-organic-process-research.php
Journal of Nutraceuticals and Food Science Open Access Journal,http://nutraceuticals.imedpub.com
Journal of Pharmaceutical Care & Health Systems Open Access Journal,https://www.omicsonline.org/pharmaceutical-care-and-health-systems-open-access.php
Journal of Pharmaceutical Microbiology Open Access Journal,http://pharmaceutical-microbiology.imedpub.com/
Journal of Pharmaceutical Sciences & Emerging Drugs Hybrid Open Access Journal,https://www.scitechnol.com/pharmaceutical-sciences-emerging-drugs.php
Journal of Pharmaceutics & Drug Delivery Research Hybrid Open Access Journal,https://www.scitechnol.com/pharmaceutics-drug-delivery-research.php
"Journal of Pharmacogenomics & Pharmacoproteomics Open Access Journal, Official Journal of European Society of Pharmacogenomics and Theranostics",https://www.omicsonline.org/pharmacogenomics-pharmacoproteomics.php
Journal of Pharmacognosy & Natural Products Open Access Journal,https://www.omicsonline.org/pharmacognosy-natural-products.php
Journal of Pharmacokinetics & Experimental Therapeutics Open Access Journal,https://www.omicsonline.org/pharmacokinetics-and-experimental-therapeutics.php
Journal of Pharmacological Reports Open Access Journal,https://www.omicsonline.org/pharmacological-reports.php
Journal of Pharmacovigilance Open Access Journal,https://www.omicsonline.org/pharmacovigilance.php
Medicinal & Aromatic Plants Open Access Journal,https://www.omicsonline.org/medicinal-aromatic-plants.php
Pharmaceutica Analytica Acta Open Access Journal,https://www.omicsonline.org/pharmaceutica-analytica-acta.php
Pharmaceutical Bioprocessing Open Access Journal,http://www.openaccessjournals.com/journals/pharmaceutical-bioprocessing.html
Pharmaceutical Regulatory Affairs: Open Access Open Access Journal,https://www.omicsonline.org/pharmaceutical-regulatory-affairs-open-access.php
Pharmacoeconomics: Open Access Open Access Journal,https://www.omicsonline.org/pharmacoeconomics-open-access.php
Research & Reviews in Pharmacy and Pharmaceutical Sciences Open Access Journal,http://www.rroij.com/pharmacy-and-pharmaceutical-sciences.php
Research & Reviews: Drug Delivery ,http://www.rroij.com/drug-delivery.php
Research & Reviews: Journal of Hospital and Clinical Pharmacy Open Access Journal,http://www.rroij.com/hospital-and-clinical-pharmacy.php
Research & Reviews: Journal of Pharmaceutical Analysis Open Access Journal,http://www.rroij.com/pharmaceutical-analysis.php
Research & Reviews: Journal of Pharmaceutical Quality Assurance Open Access Journal,http://www.rroij.com/pharmaceutical-quality-assurance.php
Research & Reviews: Journal of Pharmaceutics and Nanotechnology Open Access Journal,http://www.rroij.com/pharmaceutics-and-nanotechnology.php
Research & Reviews: Journal of Pharmacognosy and Phytochemistry Open Access Journal,http://www.rroij.com/pharmacognosy-and-phytochemistry.php
Research & Reviews: Journal of Pharmacology and Toxicological Studies Open Access Journal,http://www.rroij.com/pharmacology-and-toxicological-studies.php
Fluid Mechanics: Open Access Open Access Journal,https://www.omicsonline.org/fluid-mechanics.php
Journal of Astrophysics & Aerospace Technology Open Access Journal,https://www.omicsonline.org/astrophysics-aerospace-technology.php
"Journal of Lasers, Optics & Photonics Open Access Journal",https://www.omicsonline.org/lasers-optics-photonics.php
Journal of Physics & Astronomy ,http://www.tsijournals.com/journals/journal-of-physics-astronomy.html
Journal of Respiratory Medicine ,https://www.omicsonline.org/journal-respiratory-medicine.php
Journal of Scientific and Industrial Metrology Open Access Journal,http://metrology.imedpub.com/
Journal of Space Exploration ,http://www.tsijournals.com/journals/journal-of-space-exploration.html
Research & Reviews: Journal of Pure and Applied Physics Open Access Journal,http://www.rroij.com/pure-and-applied-physics.php
Rheology: Open Access ,https://www.omicsonline.org/rheology-open-access.php
Anthropology Open Access Journal,https://www.omicsonline.org/anthropology.php
Arts and Social Sciences Journal Open Access Journal,https://www.omicsonline.org/arts-and-social-sciences-journal.php
Intellectual Property Rights: Open Access Open Access Journal,https://www.omicsonline.org/intellectual-property-rights.php
Journal of Anthropology Reports Open Access Journal,https://www.omicsonline.org/forensic-anthropology.php
Journal of Civil & Legal Sciences Open Access Journal,https://www.omicsonline.org/civil-legal-sciences.php
Journal of Defense Management Open Access Journal,https://www.omicsonline.org/defense-management.php
Journal of Mass Communication & Journalism Open Access Journal,https://www.omicsonline.org/mass-communication-journalism.php
Journal of Political Sciences & Public Affairs Open Access Journal,https://www.omicsonline.org/political-sciences-public-affairs.php
"Journal of Socialomics Official journal of SILAE (Italy), Italo-Latin American Society of Ethnomedicine",https://www.omicsonline.org/socialomics.php
Research & Reviews: Journal of Educational Studies Open Access Journal,http://www.rroij.com/educational-studies.php
Research & Reviews: Journal of Social Sciences Open Access Journal,http://www.rroij.com/social-sciences.php
Sociology and Criminology-Open Access Open Access Journal,https://www.omicsonline.org/sociology-and-criminology.php
Journal of Animal Health and Behavioural Science ,https://www.omicsonline.org/animal-health-behavioural-science.php
Journal of Animal Research and Nutrition Open Access Journal,http://animalnutrition.imedpub.com
Journal of Animal Sciences and Livestock Production Open Access,http://www.imedpub.com/animal-sciences-and-livestock-production/
Journal of Veterinary Medicine and Allied Science ,http://www.alliedacademies.org/veterinary-medicine-and-allied-science/
Journal of Veterinary Medicine and Health ,https://www.omicsonline.org/journal-veterinary-medicine-health.php
Journal of Veterinary Pathology Research ,https://www.omicsonline.org/journal-veterinary-pathology-research.php
Journal of Veterinary Science & Medical Diagnosis Hybrid Open Access Journal,https://www.scitechnol.com/veterinary-science-medical-diagnosis.php
Journal of Veterinary Science & Technology Open Access Journal,https://www.omicsonline.org/veterinary-science-technology.php
Research & Reviews: Journal of Veterinary Sciences Open Access Journal,http://www.rroij.com/veternary-sciences.php
Research & Reviews: Journal of Zoological Sciences Open Access Journal,http://www.rroij.com/zoological-sciences.php
